{
 "generated_at": "2026-10-22T03:30:44.932729+00:00",
 "generator": "keystone metadata export",
 "completeness": {
  "models": 29,
  "models_documented": 29,
  "columns": 679,
  "columns_documented": 679,
  "datasets": 63,
  "datasets_complete": 63,
  "owners_missing": 0,
  "documented_pct": 100.0
 },
 "owner": {
  "id": "keystone-maintainers",
  "kind": "group",
  "description": "Maintainers of the keystone-pipeline repository; corrections go through its issues."
 },
 "domains": {
  "sources": "External inputs as fetched (GH Archive hourly files, OSV zips).",
  "activity": "Repository activity derived from GH Archive (silver events, rollups, repository facts).",
  "vulnerabilities": "OSV advisories and the packages they affect.",
  "packages": "Packages and their mapping to repositories.",
  "operations": "How the pipeline itself ran (metrics, lineage, quality)."
 },
 "classifications": {
  "public": "Repository- or package-level facts; safe to publish.",
  "pseudonymous": "Salted keys of accounts (ADR-019); internal only, never published.",
  "internal": "Pipeline-internal (quarantine, staging); no personal data, not published."
 },
 "datasets": [
  {
   "id": "https://data.gharchive.org/{hour}.json.gz",
   "title": "GH Archive hourly file",
   "layer": "sources",
   "domain": "sources",
   "classification": "internal",
   "description": "One gzipped JSON-lines file per UTC hour of public GitHub events (data.gharchive.org). Fetched politely, verified by MD5 and SHA-256, parsed and deleted; never republished.",
   "contract": "config/sources.yml",
   "freshness_sla_hours": 3,
   "owner": "keystone-maintainers",
   "published": false,
   "glossary_terms": [],
   "columns": [],
   "missing": []
  },
  {
   "id": "https://osv-vulnerabilities.storage.googleapis.com/{ecosystem}/all.zip",
   "title": "OSV ecosystem zip",
   "layer": "sources",
   "domain": "sources",
   "classification": "public",
   "description": "All OSV records of one ecosystem (osv.dev, CC BY 4.0), fetched conditionally.",
   "contract": "config/sources.yml",
   "freshness_sla_hours": 3,
   "owner": "keystone-maintainers",
   "published": false,
   "glossary_terms": [],
   "columns": [],
   "missing": []
  },
  {
   "id": "file://keystone/silver/gharchive/events",
   "title": "Silver GH Archive events",
   "layer": "silver",
   "domain": "activity",
   "classification": "pseudonymous",
   "description": "One row per GH Archive event; repository facts and salted actor keys only.",
   "contract": "contracts/gharchive_events.odcs.yaml",
   "freshness_sla_hours": 26,
   "owner": "keystone-maintainers",
   "published": false,
   "glossary_terms": [],
   "columns": [
    {
     "name": "source_file",
     "type": "STRING",
     "description": "Source file, `gharchive/<YYYY-MM-DD-H>.json.gz`."
    },
    {
     "name": "source_sha256",
     "type": "STRING",
     "description": "SHA-256 of the verified source file (manifest)."
    },
    {
     "name": "fetched_at",
     "type": "TIMESTAMP",
     "description": "When the source file was fetched (UTC)."
    },
    {
     "name": "source_line",
     "type": "INT64",
     "description": "1-based line number of the record in the source file."
    },
    {
     "name": "era",
     "type": "STRING",
     "description": "Schema era of the source file (E0 to E3, docs/era-map.md).",
     "glossary_terms": [
      "era"
     ]
    },
    {
     "name": "period",
     "type": "STRING",
     "description": "Completeness period of the source hour (config/sources.yml, ADR-012)."
    },
    {
     "name": "event_id",
     "type": "STRING",
     "description": "GitHub event id; absent in E1 (Timeline API has no event ids)."
    },
    {
     "name": "event_type",
     "type": "STRING",
     "description": "GitHub event type, for example PushEvent."
    },
    {
     "name": "created_at",
     "type": "TIMESTAMP",
     "description": "Event time normalised to UTC (E1 carries Pacific offsets in the source)."
    },
    {
     "name": "created_at_offset_min",
     "type": "INT64",
     "description": "UTC offset of the original created_at string, in minutes (E1 -420/-480)."
    },
    {
     "name": "public",
     "type": "BOOLEAN",
     "description": "Source `public` flag."
    },
    {
     "name": "actor_key",
     "type": "STRING",
     "description": "Salted HMAC-SHA256 (first 32 hex) of the actor's account id, or of the lower-cased login in E1. Never a login.",
     "glossary_terms": [
      "maintenance actor"
     ]
    },
    {
     "name": "actor_key_kind",
     "type": "STRING",
     "description": "What actor_key hashes, `id` or `login` (E1 only, ADR-013)."
    },
    {
     "name": "actor_is_bot",
     "type": "BOOLEAN",
     "description": "Actor login ends in `[bot]` or is in config/bots.yml."
    },
    {
     "name": "repo_id",
     "type": "INT64",
     "description": "GitHub repository id; absent in E1 2012 and for some E0 events."
    },
    {
     "name": "repo_name",
     "type": "STRING",
     "description": "Repository full name `owner/name` at event time."
    },
    {
     "name": "action",
     "type": "STRING",
     "description": "Payload action (opened, closed, started, published, ...)."
    },
    {
     "name": "number",
     "type": "INT64",
     "description": "Pull request or issue number, when the payload has one."
    },
    {
     "name": "ref_type",
     "type": "STRING",
     "description": "Create/Delete ref type (repository, branch, tag)."
    },
    {
     "name": "ref",
     "type": "STRING",
     "description": "Git ref of a push, create or delete."
    },
    {
     "name": "push_head",
     "type": "STRING",
     "description": "Push head commit SHA."
    },
    {
     "name": "push_before",
     "type": "STRING",
     "description": "Push previous head SHA (E2 and E3)."
    },
    {
     "name": "push_size",
     "type": "INT64",
     "description": "Commits in the push (absent after the payload trim, 2025-10-08 16:59:22Z)."
    },
    {
     "name": "push_distinct_size",
     "type": "INT64",
     "description": "Distinct commits in the push (E2 only)."
    },
    {
     "name": "payload_repository_id",
     "type": "INT64",
     "description": "Payload repository id of a push (late E2 and E3)."
    },
    {
     "name": "pr_merged",
     "type": "BOOLEAN",
     "description": "PullRequestEvent merged flag (E1 and E2 only)."
    },
    {
     "name": "pr_created_at",
     "type": "TIMESTAMP",
     "description": "Pull request creation time, UTC (E1 and E2)."
    },
    {
     "name": "pr_merged_at",
     "type": "TIMESTAMP",
     "description": "Pull request merge time, UTC (E1 and E2)."
    },
    {
     "name": "pr_closed_at",
     "type": "TIMESTAMP",
     "description": "Pull request close time, UTC (E1 and E2)."
    },
    {
     "name": "pr_author_key",
     "type": "STRING",
     "description": "Salted key of the pull request author, same kind as actor_key."
    },
    {
     "name": "issue_id",
     "type": "INT64",
     "description": "Issue id of an IssuesEvent or IssueCommentEvent."
    },
    {
     "name": "issue_created_at",
     "type": "TIMESTAMP",
     "description": "Issue creation time, UTC (E2 and E3)."
    },
    {
     "name": "issue_closed_at",
     "type": "TIMESTAMP",
     "description": "Issue close time, UTC (E2 and E3)."
    },
    {
     "name": "issue_author_key",
     "type": "STRING",
     "description": "Salted key of the issue author, same kind as actor_key."
    },
    {
     "name": "issue_is_pr",
     "type": "BOOLEAN",
     "description": "The issue is a pull request (E2 and E3)."
    },
    {
     "name": "comment_id",
     "type": "INT64",
     "description": "Comment id of an IssueCommentEvent."
    },
    {
     "name": "comment_created_at",
     "type": "TIMESTAMP",
     "description": "Comment creation time, UTC (E2 and E3)."
    },
    {
     "name": "release_tag",
     "type": "STRING",
     "description": "ReleaseEvent tag name."
    },
    {
     "name": "release_published_at",
     "type": "TIMESTAMP",
     "description": "Release publish time, UTC."
    },
    {
     "name": "release_prerelease",
     "type": "BOOLEAN",
     "description": "Release is a pre-release."
    }
   ],
   "missing": []
  },
  {
   "id": "file://keystone/silver/gharchive/hour_types",
   "title": "Silver hour x event-type counts",
   "layer": "silver",
   "domain": "activity",
   "classification": "public",
   "description": "Events per source hour and type, with the hour's era and completeness period.",
   "contract": "contracts/gharchive_hour_types.odcs.yaml",
   "freshness_sla_hours": 26,
   "owner": "keystone-maintainers",
   "published": false,
   "glossary_terms": [],
   "columns": [
    {
     "name": "source_file",
     "type": "STRING",
     "description": "Source file, `gharchive/<YYYY-MM-DD-H>.json.gz`."
    },
    {
     "name": "source_sha256",
     "type": "STRING",
     "description": "SHA-256 of the verified source file."
    },
    {
     "name": "fetched_at",
     "type": "TIMESTAMP",
     "description": "When the source file was fetched (UTC)."
    },
    {
     "name": "hour",
     "type": "TIMESTAMP",
     "description": "Hour in the file name, as UTC. In E1 file names are Pacific-local hours, so the events' UTC times are 7 or 8 hours later (see created_at_min)."
    },
    {
     "name": "era",
     "type": "STRING",
     "description": "Schema era of the source file.",
     "glossary_terms": [
      "era"
     ]
    },
    {
     "name": "period",
     "type": "STRING",
     "description": "Completeness period of the source hour."
    },
    {
     "name": "event_type",
     "type": "STRING",
     "description": "GitHub event type."
    },
    {
     "name": "events",
     "type": "INT64",
     "description": "Parsed events of this type in the file."
    },
    {
     "name": "created_at_min",
     "type": "TIMESTAMP",
     "description": "Earliest created_at of this type in the file, UTC."
    },
    {